{
  "$schema": "https://kimetsu.dev/schemas/well-known-agent-directory-v1.schema.json",
  "schema_version": "1.0",
  "name": "kimetsu.dev public agent directory",
  "gateway": "https://agents.kimetsu.dev/",
  "fallback": "https://kimetsu.dev/agent-gateway.json",
  "llms_txt": "https://kimetsu.dev/llms.txt",
  "projects": "https://kimetsu.dev/projects/",
  "authentication": "none",
  "read_only": true,
  "a2a_agent_card": "https://agents.kimetsu.dev/.well-known/agent-card.json",
  "warning": "Do not send credentials or private data. Use the separate A2A Agent Card for deterministic Sidequest guidance."
}
